[
  {
    "name": "Capoeira Pasifika Mandinga Aotearoa",
    "website": "http://www.capoeira.org.nz/",
    "leader": {
      "title": "mestre",
      "nickname": "Brabo",
      "name": null
    },
    "mainContact": {
      "name": null,
      "email": "brabo@capoeira.org.nz",
      "phone": null
    },
    "sources": [],
    "locations": [],
    "notes": "SOURCE: website 1/11/11",
    "rawRecord": "New Zealand\n\n      Capoeira Pasifika Mandinga Aotearoa\nhttp://www.capoeira.org.nz/\nMestre Brabo\n  brabo@capoeira.org.nz\n      Auckland Capoeira Academy and Cultural Centre\n29 Randolph Str  Newton (behind the 'Golf Warehouse)\ncapoeira@capoeira.org.nz\nin  Taranaki  Rastinha and Mandingueiro \"Hannah and Josh\"\n   027 327 9716 or 06 752 4065\n   Taranaki@capoeira.org.nz\n      Central Primary School Hall\nPendarves/Lemon St, NP\nin Wellington  Bobby\n   ziguezague@gmail.com\n      Thistle Hall Community Centre\n293 Cuba Street, Te Aro, Wellington, 6011\n      Aro Valley Community Hall\nin Christchurch Leite Quente\n  capoeira@qudo.org.nz\n      Qudo Movement Theatre\n207 Cambridge Tce, Christchurch\nSOURCE: website 1/11/11"
  },
  {
    "name": "Nge Shujaa Chando Capoeira",
    "website": "http://www.myspace.com/scorpioncapoeira",
    "leader": null,
    "mainContact": {
      "name": null,
      "email": "capoeirawarriors@yahoo.com",
      "phone": null
    },
    "sources": [],
    "locations": [],
    "notes": "SOURCE: email  12/116/11",
    "rawRecord": "Auburn\n\n      Nge Shujaa Chando Capoeira\nhttp://www.myspace.com/scorpioncapoeira\nMfundi Omari Naeem\ncapoeirawarriors@yahoo.com\n(Will be inactive starting as of May 2012)\nSOURCE email  12/116/11"
  },
  {
    "name": "Capoeira Canberra",
    "website": "http://soulcapoeira.org/capoeira-australia/",
    "leader": null,
    "mainContact": {
      "name": null,
      "email": "lesimon@hotmail.com",
      "phone": null
    },
    "sources": ["http://soulcapoeira.org/capoeira-australia/"],
    "locations": [],
    "notes": "SOURCE: http://soulcapoeira.org/capoeira-australia/ 12/21/10",
    "rawRecord": "Northern  and  Capital Territories\n\n\n      Capoeira Canberra\nSimon Le\nlesimon@hotmail.com\nSOURCE:  http://soulcapoeira.org/capoeira-australia/ 12/21/10"
  },
  {
    "name": "Sinha Bahia de Capoeira..",
    "website": "http://www.capoeira.cc/_/",
    "leader": {
      "title": "mestre",
      "nickname": "Cicatriz",
      "name": null
    },
    "mainContact": {
      "name": null,
      "email": null,
      "phone": null
    },
    "sources": [],
    "locations": [],
    "notes": "SOURCE: website 11/22/10",
    "rawRecord": "New South Wales\n\n\n      Sinha Bahia de Capoeira..\nhttp://www.capoeira.cc/_/\nMestre Cicatriz\n      The Rocks:\nFort St Primary School, Watson Road, Observatory Hill\nBeginners: Wed  6:30 - 7:30pm\nAll levels: Wed 7:30 - 8:30pm\n      Dougherty Centre,\n7 Victor St, Chatswood\nBeginners: Mon  6:30 - 7:30pm\n      Rockdale Community Church of Christ Hall\n3-5 Bryant Street, Rockdale\nBeginners: Tues & Thurs 6:30 - 7:30pm\nGraduado Soquete\n       Memorial Hall,\n1606 Pittwater Rd, Mona Vale\nbeginners: Thurs 7:30 - 8:30pm\n Graduado Serpente\n       St Basils Anglican Church\n6 Broughton Rd Artarmon\nBeginners Thurs 6:30 - 7:30pm\nAlegria\n      Liverpool Pipe Band Hall\n90 Memorial Ave, Liverpool (on the drive up to the Whitlam centre,\nbefore round-about)\nBeginners: Sat 10:30-11:30\nSOURCE: website 11/22/10"
  },
  {
    "name": "Associacao Sinha Bahia de Capoeira",
    "website": "http://www.capoeira.com.ph/",
    "leader": {
      "title": "mestre",
      "nickname": "Torpedo",
      "name": "Renato Gomes de Reis "
    },
    "mainContact": {
      "name": null,
      "email": null,
      "phone": null
    },
    "sources": [],
    "locations": [],
    "notes": "SOURCE: website 1/14/11",
    "rawRecord": "Philippines\n\n      Associacao Sinha Bahia de Capoeira\nMetro Manila\nMestre Torpedo  \"Renato Gomes de Reis \"\n http://www.capoeira.com.ph/\n      Club 650\nLibis,Quezon City\n      Amezcua Wellness Center\nWhite Plains, Quezon City\n      Gold's Gym Galleria\nOrtigas Center, Pasig City\n      Gold's Gym Glorietta 3\nMakati City\n      SM Megamall B\nOrtigas Center, Pasig City\n      Kennedy Center\nMadrigal [along Zapote Road], Alabang\nCebu City\nhttp://www.capoeira.ph/\nInstructor Jensen\nCoaches Exqisito, Podim, Rabo and Rato\n      Level 3, Luym Building\nCorner of Plaridel St and Osmena Blvd, Cebu City\n      Table Tennis Room, Cebu City Sports Club\nCardinal Rosales Avenue, Cebu Business Park, Cebu City (opposite\nMariott)\nSOURCE: website 1/14/11"
  },
  {
    "name": "Capoeira Angola Center Arizona",
    "website": "http://www.facebook.com/profile.php?id=100001040611973",
    "leader": null,
    "mainContact": {
      "name": null,
      "email": "capoeiraangolacenteraz@gmail.com",
      "phone": null
    },
    "sources": ["http://www.joaogrande.org/affiliates.htm"],
    "locations": [],
    "notes": "SOURCE: http://www.joaogrande.org/affiliates.htm",
    "rawRecord": "Phoenix\n\n      Capoeira Angola Center Arizona\nPhoenix, Arizona\nProf  Xango \"Ivan Pena\"\nhttp://www.facebook.com/profile.php?id=100001040611973\nhttp://www.myspace.com/capoeiraangolacenteraz\nEmail: capoeiraangolacenteraz@gmail.com\nSOURCE:  http://www.joaogrande.org/affiliates.htm \n6/4/12"
  },
  {
    "name": "Capoeira Angola Center of Arizona [CAC AZ]",
    "website": "http://www.myspace.com/kilombonovo_az",
    "leader": null,
    "mainContact": {
      "name": null,
      "email": "stormshadow0610@cox.net",
      "phone": "602-791-754"
    },
    "sources": [],
    "locations": [],
    "notes": "SOURCE: email 11/27/09",
    "rawRecord": "Tempe\n\n      Capoeira Angola Center of Arizona [CAC AZ]\n      Capoeira Angola Kilombo Novo AZ\nhttp://www.myspace.com/kilombonovo_az\nInstructor: Xango\n  Phone:   602-791-754\n  Email: stormshadow0610@cox.net\nSOURCE:  email 11/27/09"
  },
  {
    "name": "Capoeira Malandragem-United Capoeira Association.",
    "website": "http://www.tucsoncapoeira.org/",
    "leader": {
      "title": "professor",
      "nickname": "Lagarta de Fogo,,and Monitor Besouro",
      "name": null
    },
    "mainContact": {
      "name": null,
      "email": "besouro@capoeiramalandragem.com",
      "phone": "1"
    },
    "sources": [],
    "locations": [],
    "notes": "SOURCE: website 3/30/11",
    "rawRecord": "Tucson\n\n      Capoeira Malandragem-United Capoeira Association.\nhttp://www.tucsoncapoeira.org/\nContramestre Dondi  , Professor Lagarta de Fogo,,and Monitor Besouro\nPhone: 1.520.631.8604\nbesouro@capoeiramalandragem.com\n      CrossFit Works\n204 S. Tucson Blvd. Tucson AZ\nBeginners: 5:30-6:30 Mon, Tues, Wed  & Fri\nChildren [6-12 yrs]: 4:30-5:30 Mon & Wed\nAll Levels:  6:30-8:00 Wed\nAll Levels/Music:  6:30-8:30 Mon\nCapoeira and More, Specialty Class: Sun 5:00-6:30\nSOURCE: website 3/30/11"
  },
  {
    "name": "Capoeira Beribazu",
    "website": "http://www.bristolcapoeira.com/",
    "leader": null,
    "mainContact": {
      "name": null,
      "email": "bristolcapoeira@hotmail.com",
      "phone": null
    },
    "sources": [],
    "locations": [],
    "notes": "SOURCE: website 7/5/09",
    "rawRecord": "Bath and Bristol\n\n\n      Capoeira Beribazu\nhttp://www.bristolcapoeira.com/\nProf. Claudio Campos\n  bristolcapoeira@hotmail.com\n  07882745860\n      University of Bristol Students Union\nQueens Road, Clifton, Bristol, BS8 1LN\n      St Matthias Campus\nOldbury Court Road, Fishponds, Bristol BS16 2JP\nMon   6-7:30pm ( in term time)\n      Hotwells Dance Centre\nJacobs Wells Rd, Hotwells, Bristol BS8 1DX\nTues  6:20-7:50pm (in term time)\n      University Of Bristol Capoeira Society\nhttp://www.bris.ac.uk/Depts/union/capoeira/\nSOURCE: website 7/5/09"
  },
  {
    "name": "Highland Capoeira Association",
    "website": null,
    "leader": null,
    "mainContact": {
      "name": null,
      "email": "jfraserm@yahoo.com",
      "phone": null
    },
    "sources": [],
    "locations": [],
    "notes": "SOURCE: google 3/20/09( please contact us if you have any current",
    "rawRecord": "Inverness\n\n      Highland Capoeira Association\nFraser Macdonald\njfraserm@yahoo.com\n 07796688663\nSOURCE: google 3/20/09( please contact us if you have any current\ninformation)"
  },
  {
    "name": "Capoeira Communities Ltd- Cordo de Ouro UK Capoeira,",
    "website": "http://capocoms.org.uk",
    "leader": {
      "title": "mestre",
      "nickname": "Papa-Leguas",
      "name": null
    },
    "mainContact": {
      "name": null,
      "email": "info@capocoms.org.uk",
      "phone": "01603 612325"
    },
    "sources": [],
    "locations": [],
    "notes": "SOURCE: website 7/20/12",
    "rawRecord": "Norfolk\n\n      \n      \n      \n      \n      \n      Capoeira Communities Ltd- Cordo de Ouro UK Capoeira,\nhttp://capocoms.org.uk\n under Contra-Mestre Papa-Leguas\nTel: 01603 612325\nEmail: info@capocoms.org.uk\n22 St.Phillips Rd Norwich Norfolk NR2 3BL\n      St.Thomas Church Hall,\nEarlham Road Norwich NR2 3HG\n4yrs to 8yrs  all Levels :Tues 15:30 -16:15pm\n 8yrs to 14yrs  all Levels: Tues16:15 - 17:15pm\n      Anglia Performing Arts Centre\nopp. Glasshouse Wensum St. NR3 1HG\n 6 years+  movements: Sat  12 ~1pm\nSOURCE: website 7/20/12"
  },
  {
    "name": "Bai Lang Martial Arts",
    "website": "http://www.sportfocus.com/comdir/cditem.cfm?nid=59681",
    "leader": null,
    "mainContact": {
      "name": null,
      "email": "dw@bailang.co.uk",
      "phone": "0800 0 436 936"
    },
    "sources": ["http://www.sportfocus.com/comdir/cditem.cfm?nid=59681"],
    "locations": [],
    "notes": "SOURCE: http://www.sportfocus.com/comdir/cditem.cfm?nid=59681",
    "rawRecord": "Shropshire\n      \n      Bai Lang Martial Arts\nDavid Whitfield\nUnit 28\nHortonwood 33\nTelford, Shropshire, TF1 7EXUK\nPhone: 0800 0 436 936\nEmail: dw@bailang.co.uk\nPhone: 01952 606598\nThe club also offers tuition in Wing Chun Kung Fu as well as Capoeira\nvia external instructors.\nSOURCE: http://www.sportfocus.com/comdir/cditem.cfm?nid=59681"
  },
  {
    "name": "Amazonas Capoeira Academy",
    "website": "http://www.capoboneco.org.uk/",
    "leader": {
      "title": "professor",
      "nickname": "Boneco",
      "name": null
    },
    "mainContact": {
      "name": null,
      "email": "boneco@capoboneco.org.uk",
      "phone": null
    },
    "sources": [],
    "locations": [],
    "notes": "SOURCE: website 8/22/09",
    "rawRecord": "Sussex\n\n\n      Amazonas Capoeira Academy\nhttp://www.capoboneco.org.uk/\nProfessor Boneco\n07919586299\nboneco@capoboneco.org.uk (not currently\non website)\n      Middle Street Primary School\nMiddle Street Brighton BN1 1AL\n All Levels Capoeira  [2,3,4]:  Mon 18:30-20:00\n Induction Course [0,1]: Tues 18:30-19:30\nBeginners [1,2]:  Mon  20:00-21:30\nIntermediate & Advanced  Capoeira Angola [2,3,4]:  Tues\n19:30-21:00\n      Cornerstone Community Center\nChurch Road  Hove BN3 2FL\nBeginners [1.2]: Wed\n      Hanover Community Center\n33 Southover St Brighton, BN2 9UD\nAll levels Capoeira Angola [2,3,4]:  Thursday 19:30 -21:45\n      West Hill Community Center\nCompton Avenue, Brighton, BN1 3PS\nAll Levels Capoeira :  Friday 19:20 - 21:00\nSOURCE: website 8/22/09\nLondon  http://www.amazonas.org.uk/"
  },
  {
    "name": "Ile de Capoeira",
    "website": null,
    "leader": {
      "title": "mestre",
      "nickname": "Maxwel",
      "name": null
    },
    "mainContact": {
      "name": null,
      "email": "mestremaxwell@hotmail.com",
      "phone": null
    },
    "sources": [],
    "locations": [],
    "notes": "SOURCE: email 1/16/10 website 1/16/10",
    "rawRecord": "Wales\n\n      Ile de Capoeira\nMestre Maxwel\nhttp//www.ilecapoeira.org.uk\n0044[0]1792515 212\nmestremaxwell@hotmail.com\n      Swansea College Llwyn-y-Bryn-Counterpoint Theatre\nMon. 1900-2000\n       Swansea  University- Fulton House Dining Room C\nTues. 1700-1800\n       Swansea Metropolitan University-Townhill- Main Sports Hall\nThurs.  Kids: 1700-1800;  Beginners: Thurs. 1800-1900; Advanced:\nThurs 1900-2000\nSOURCE: email 1/16/10 website 1/16/10"
  },
  {
    "name": "Chico State Capoeira-Capoeira Males",
    "website": "http://www.csuchico.edu/cscap/",
    "leader": {
      "title": "mestre",
      "nickname": "Curisco[Seattle]",
      "name": null
    },
    "mainContact": {
      "name": null,
      "email": "geckolovin@hotmail.com",
      "phone": "[530] 520-5504"
    },
    "sources": [],
    "locations": [],
    "notes": "SOURCE: website 4/7/11",
    "rawRecord": "Butte County\n\n\n      Chico State Capoeira-Capoeira Males\nhttp://www.csuchico.edu/cscap/\nmafiliated with Mestre Curisco[Seattle]\n India \"Kalenne Gorospe\"\n  Email - geckolovin@hotmail.com\nPeriquito \"Robert Washington\"\n  Email - bboybobby@hotmail.com\n  Phone: [530] 520-5504\n      Studio One\n707 Wall Chico, CA. 95928\nAll Levels: Wed 5:30-7:00pm\n      InMotion Fitness\n1293 E. First Avenue Chico, CA 95928\nPhone [530] 343-5678\nAll Levels: Tues & Thurs 8:00-9:30pm\n      Athletic Horizons\nAcrobatics: Thurs 8:00-9:30pm ( in place of  InMotion class)\nSOURCE:  website 4/7/11"
  },
  {
    "name": "Humboldt Capoeria Group-BerimBrasil",
    "website": "http://home.thegrid.net/~lcoyle/about.htm",
    "leader": {
      "title": "mestre",
      "nickname": "Canguru",
      "name": null
    },
    "mainContact": {
      "name": null,
      "email": null,
      "phone": null
    },
    "sources": [],
    "locations": [],
    "notes": "SOURCE: website 4/14/11",
    "rawRecord": "Humboldt County\n\n\n      Humboldt Capoeria Group-BerimBrasil\nMestre Canguru\nhttp://home.thegrid.net/~lcoyle/about.htm\nContact: 707-498-6155\n      The Old Cremery\n      New World Ballet Dance Studio\nArcata\nend of 9th st,\nAll Levels: Mon 7:30-9, Wed & Fri 6:00-8:00\nKids Class: Mon 3:00-4:00 beginner & 4:00-5:00 advanced\n      Beginnings Dojo\nBriceland CA\nAll ages: Tues & Thurs 3:30-5:00\nSOURCE: website 4/14/11"
  },
  {
    "name": "Capoeira Mandinga of West Marin",
    "website": "http://www.marin.org/bizmo/biz_org.cfm?OrgID=7451",
    "leader": {
      "title": "mestra",
      "nickname": "Sorriso",
      "name": null
    },
    "mainContact": {
      "name": null,
      "email": "gracebeautypassion@yahoo.com",
      "phone": null
    },
    "sources": ["http://www.marin.org/bizmo/biz_org.cfm?OrgID=7451", "http://www.myspace.com/mandingawestmarin"],
    "locations": [],
    "notes": "SOURCE: email 8/28/08 SOURCE: http://www.marin.org/bizmo/biz_org.cfm?OrgID=7451 last updated - 05/03/2010 SOURCE: http://www.myspace.com/mandingawestmarin",
    "rawRecord": "Marin County\n\n      Capoeira Mandinga of West Marin\nMestra Sorriso\n  PO Box 596 Forest Knolls CA 94933\n  415 488 1988\nSOURCE: email 8/28/08\n  415.488.1988\n gracebeautypassion@yahoo.com\nSOURCE:\nhttp://www.marin.org/bizmo/biz_org.cfm?OrgID=7451 last updated - 05/03/2010\n Mestra Sorriso, Instructor Sagui, Instructor Mulambu, and Instructor\nGaviao\n      Fairfax Pavillion\nElsie Lane. (behind Peri Park and next to the Baseball field behind\ndowntown Fairfax).\nMon, Wed  & Fri, 6:30-9:00pm.\n      Lagunitas School\n      San Geronimo Valley Community Center\n      Saint Ritas\nSOURCE: http://www.myspace.com/mandingawestmarin\n2/8/11"
  },
  {
    "name": "Os Malandros de Mestre Touro -Capoeira Angola Sao Bento Grande",
    "website": "http://www.malandros-touro.com/",
    "leader": {
      "title": "mestre",
      "nickname": "Touro -Capoeira Angola Sao Bento Grande",
      "name": null
    },
    "mainContact": {
      "name": null,
      "email": null,
      "phone": null
    },
    "sources": [],
    "locations": [],
    "notes": "SOURCE: website 12/26/10",
    "rawRecord": "San Diego County\n\n      Os Malandros de Mestre Touro -Capoeira Angola Sao Bento Grande\nMestre Preto Velho \"Dennis Newsome\"\nLINEAGE: Mestre Paizinho >Mestre Artur Emidio>Mestre\nLeopoldina>Mestre Celgo Pepe>Mestre Touro> Mestre Preto Vello\nhttp://www.malandros-touro.com/\n      San Diego Head-Quarters\n6429 Imperial Avenue San Diego, CA 92114\n619-518-7782\n      World Beat Center\n2100 Park Blvd.San Diego, CA 92101\n619-518-7782\nSat  11:15 am - 1:15 pm\nSOURCE: website 12/26/10"
  },
  {
    "name": "Capoeira USA-Capoeira Cordao de Ouro",
    "website": "http://www.capoeirausa.com",
    "leader": {
      "title": "mestre",
      "nickname": "Urubu Malandro",
      "name": null
    },
    "mainContact": {
      "name": null,
      "email": "Mestre@capoeirausa.com",
      "phone": "[415] 509-6624"
    },
    "sources": [],
    "locations": [],
    "notes": "SOURCE: website 5/30/11",
    "rawRecord": "San Francisco\n\n      Capoeira USA-Capoeira Cordao de Ouro\nhttp://www.capoeirausa.com\nMestre Urubu Malandro\nMestre@capoeirausa.com\nphone:[415] 509-6624\n      Present Creative\n2729 Mission st. #201, San Francisco, CA\nTues & Fri 9:00-11:00am\n      Project Commotion\n2095 Harrison St, San Francisco, CA 94110\nSat 12-1:30pm; Mon & Wed 7-8:30pm; Fri 6:30 -8pm\n      AcroSports Gym\n639 Frederick St San Francisco, CA 94117\n[415] 665-2276\n http://www.acrosports.org\nTues & Thurs 7:30-9:00pm Sat. 2:00-330pm\n      San Francisco State Unverstity\nMon & Wed 1:00\n      St Finn Barr School\n419 Hearst Ave San Francisco, CA 94112\nPhone: [415] 333-1800\nKids ages 8+ : Fri 3:15-4:15\nFormiguinha\n      Jewish Community Center of San Francisco\n3200 California Street  San Francisco CA (at Presidio)\nYouth Classes ages 7 - 12: Mon 5 - 6pm\nTeen and Adult Classes:  Mon 6 - 7:30pm\n      Project Commotion\n2095 Harrison St, San Francisco, CA 94110\nages 2 &frac12; - 5 years with Parent/caretaker: Tues 8:30-9:20am\nCapoeira Criancas Ages 3&frac12; - 5: Mon 4:30-5:20pm Thurs\n4- 4:50pm\n6 and up BeginnersWed 4:30- 5:30pm\n6 and up Intermediate/Advanced: Wed 5:30 6:45pm\nDrop-In Fundamentals for Floreios ages 5 years to AdultSat 12:15- 2:00pm\nSOURCE:  website 5/30/11"
  },
  {
    "name": "Quizumba Capoeira",
    "website": "http://quizumba.org/",
    "leader": {
      "title": "mestre",
      "nickname": "Itabora",
      "name": null
    },
    "mainContact": {
      "name": null,
      "email": null,
      "phone": null
    },
    "sources": [],
    "locations": [],
    "notes": "SOURCE: website 6/5/11",
    "rawRecord": "San Luis Obispo Capoeira\n   \n\n\n\n                       San Luis Obispo\n\n\n(We have no current information please contact us)\nThe Capoeira List\n\n\n\n\n\n\n                       San Mateo County\n\n      Quizumba Capoeira\nhttp://quizumba.org/\nMestre Itabora\n  415-722-8525\n      Undisputed Boxing Gym\n883 East San Carlos Avenue, San Carlos, CA.\nMon 7-8:15pm Wed: 6-7pm Fri: 7-8:15pm Sun 11-12:30\nSOURCE: website 6/5/11"
  },
  {
    "name": "Capoeira Association of Stanford University",
    "website": "http://brazilca.com/",
    "leader": {
      "title": "mestre",
      "nickname": "Beicola",
      "name": null
    },
    "mainContact": {
      "name": null,
      "email": "mestre-beicola@brazilca.com",
      "phone": null
    },
    "sources": [],
    "locations": [],
    "notes": "SOURCE: websites 6/8/11",
    "rawRecord": "Santa Clara County\n\n\nCapoeira Narahari\nhttp://brazilca.com/\nMestre Beicola\n  mestre-beicola@brazilca.com\nLINEAGE Mestre Paizinho > Mestre Artur Emidio> Mestre Leopoldina\n> Mestre CelgoPepe>Mestre Touro>Mestre Beicola,\n      Capoeira Association of Stanford University\nhttp://stanfordcapoeira.org/\n      Ford Center-San Diego Room\nGalvez St. Stanford, CA 94305\nSOURCE: websites 6/8/11"
  },
  {
    "name": "Capoeira Azania",
    "website": "http://www.capoeiraazania.com",
    "leader": {
      "title": "mestre",
      "nickname": "Fabio",
      "name": null
    },
    "mainContact": {
      "name": null,
      "email": "fabio@capoeiraazania.com",
      "phone": "[415] 314"
    },
    "sources": [],
    "locations": [],
    "notes": "SOURCE: website 6/11/11",
    "rawRecord": "Sonoma County\n\n\n      Capoeira Azania\nhttp://www.capoeiraazania.com\nContra Mestre Fabio\n  Cell: [415] 314 ï¿½ 7623\n  fabio@capoeiraazania.com\n      Petaluma School of Ballet\n110 Howard Street, Petaluma, CA 94952\nAll Levels:Mon 7:00-8:30pm Wed 6:30-8:30pm\nKids Classes: Sat 10:00am\nSOURCE: website 6/11/11"
  },
  {
    "name": "Grupo Capoeira Males [formerly Quilombo do Queimado] ,",
    "website": "http://www.capoeiramales.com/",
    "leader": {
      "title": "mestre",
      "nickname": "Lua Branca",
      "name": null
    },
    "mainContact": {
      "name": null,
      "email": "camarao_capoeira@hotmail.com",
      "phone": null
    },
    "sources": [],
    "locations": [],
    "notes": "SOURCE: website 1/4/11",
    "rawRecord": "Burlington\n\n\n      Grupo Capoeira Males [formerly Quilombo do Queimado] ,\nhttp://www.capoeiramales.com/\nContra Mestre Lua Branca\nContact : Camarao\n  [647] 283-0462\n  camarao_capoeira@hotmail.com.\n      Sidekicks School of Martial Arts\n2421 New Street,  Burlington, Ontario\n Mon 9:00-10:30pm,  Wed. 7:30pm - 9:00pm, Sat. 12:30pm -\n2:00pm\nSOURCE: website 1/4/11"
  },
  {
    "name": "Capoeira Gingativa",
    "website": "http://www.gingativa.com/",
    "leader": {
      "title": "mestre",
      "nickname": "Frankenstein",
      "name": "Frankie Da' Silva"
    },
    "mainContact": {
      "name": null,
      "email": null,
      "phone": null
    },
    "sources": [],
    "locations": [],
    "notes": "SOURCE: website 1/15/11",
    "rawRecord": "Calgary\n\n\n      Capoeira Gingativa\n201 3811 Edmonton Trail NE Calgary, Alberta, T2E-3P5\nhttp://www.gingativa.com/\nContra-Mestre Frankenstein  \"Frankie Da' Silva\"\n  [403] 827-7917\nSOURCE: website 1/15/11"
  },
  {
    "name": "Capoeira Regional Edmonton Association - Associacao",
    "website": "http://www.capoeiraedmonton.ca/",
    "leader": {
      "title": "mestre",
      "nickname": "Bimba",
      "name": null
    },
    "mainContact": {
      "name": null,
      "email": "admin@capoeiraedmonton.ca",
      "phone": "[780] 709-3500"
    },
    "sources": [],
    "locations": [],
    "notes": "SOURCE: websites 1/15/11",
    "rawRecord": "Edmonton\n\n      Capoeira Regional Edmonton Association - Associacao\nde Capoeira Mestre Bimba\nhttp://www.capoeiraedmonton.ca/\nInstructor: Reni Lima Ferreira\nPO Box 47057 RPO 62 Edmonton City Centre Edmonton, AB T5J 4N1\nPhone: [780] 709-3500\nEmail: admin@capoeiraedmonton.ca\n      Mile Zero Dance\n9535-Jasper Avenue\n      Hazeldean Elementary School\n6715-97 Street\n       University of Alberta Capoeira  Club\nhttp://www.campusrec.ualberta.ca/activityclubs/capoeira.cfm\n      Van Vliet Center  room W-87\nIntroductory Classes: Wed    6:30-7:30 pm  \n7:30-8:30 pm\n SOURCE: websites 1/15/11"
  }
]
